{
  "created_in": "TXN-000013",
  "current": {
    "assertion": {
      "adoption_evidence": [],
      "asserted_by": "principal:synthetic-user",
      "kind": "user-stated",
      "reliability_note": "Fictional teaching scenario; these people and documents do not exist."
    },
    "conditions": [],
    "confidence": 1.0,
    "confidence_basis": "Clear fictional speaker statement; this score describes interpretation, not factual truth.",
    "consequences": [],
    "edges": {},
    "importance": "high",
    "parent_bases": [],
    "statement": "Keep the shared queue at Riverside; skipping it was rejected.",
    "status": "rejected",
    "title": "Rejected queue removal",
    "triggers": [],
    "type": "idea",
    "valid_from": "2026-09-23T11:12:00Z",
    "valid_time_note": null,
    "valid_until": null,
    "why": "Without one record, volunteers could promise one item twice."
  },
  "current_revision_id": "LIB-IDEA-0001.r1",
  "derivation_map_ref": null,
  "format_version": "1",
  "history_ref": "rev://LIB-IDEA-0001.r1",
  "id": "LIB-IDEA-0001",
  "instance_id": "alm.synthetic.example",
  "kind": "record",
  "registered_derivative_count": 0,
  "revision_count": 1,
  "scope_id": "PROJECT-LIBRARY",
  "updated_in": "TXN-000013"
}
