{
  "created_in": "TXN-000015",
  "current": {
    "assertion": {
      "adoption_evidence": [],
      "asserted_by": "principal:synthetic-user",
      "kind": "user-stated",
      "reliability_note": "Fictional teaching scenario; these people and documents do not exist."
    },
    "conditions": [],
    "confidence": 1.0,
    "confidence_basis": "Clear fictional speaker statement; this score describes interpretation, not factual truth.",
    "consequences": [],
    "edges": {
      "promoted_from": [
        "LIB-RULE-0005"
      ]
    },
    "importance": "high",
    "parent_bases": [],
    "statement": "Branches may confirm pickups by phone when useful, but all confirmations stay in the shared queue.",
    "status": "active",
    "title": "Optional phone confirmation",
    "triggers": [],
    "type": "rule",
    "valid_from": "2026-09-23T11:15:00Z",
    "valid_time_note": null,
    "valid_until": null,
    "why": "Riverside's experience showed an access benefit without losing one reservation record."
  },
  "current_revision_id": "SYS-RULE-0020.r1",
  "derivation_map_ref": null,
  "format_version": "1",
  "history_ref": "rev://SYS-RULE-0020.r1",
  "id": "SYS-RULE-0020",
  "instance_id": "alm.synthetic.example",
  "kind": "record",
  "registered_derivative_count": 0,
  "revision_count": 1,
  "scope_id": "GLOBAL",
  "updated_in": "TXN-000015"
}
