{
  "created_in": "TXN-000018",
  "current": {
    "assertion": {
      "adoption_evidence": [
        "win://WIN-00019"
      ],
      "asserted_by": "principal:assistant",
      "kind": "AI-inferred",
      "reliability_note": "Fictional teaching scenario; these people and documents do not exist."
    },
    "conditions": [],
    "confidence": 1.0,
    "confidence_basis": "Clear fictional speaker statement; this score describes interpretation, not factual truth.",
    "consequences": [],
    "edges": {},
    "importance": "high",
    "parent_bases": [],
    "statement": "Publish a large-print weekly lending and event schedule at the desk.",
    "status": "active",
    "title": "Large-print weekly schedule",
    "triggers": [],
    "type": "rule",
    "valid_from": "2026-09-23T11:18:00Z",
    "valid_time_note": null,
    "valid_until": null,
    "why": "Members who miss email and volunteers answering calls need the same visible information."
  },
  "current_revision_id": "SYS-RULE-0010.r2",
  "derivation_map_ref": null,
  "format_version": "1",
  "history_ref": "rev://SYS-RULE-0010.r2",
  "id": "SYS-RULE-0010",
  "instance_id": "alm.synthetic.example",
  "kind": "record",
  "registered_derivative_count": 0,
  "revision_count": 2,
  "scope_id": "GLOBAL",
  "updated_in": "TXN-000020"
}
