{
  "created_in": "TXN-000011",
  "current": {
    "assertion": {
      "adoption_evidence": [],
      "asserted_by": "source:synthetic-booking-sheet",
      "kind": "document",
      "reliability_note": "The retained source is an assistant report about a fictional booking sheet; the sheet itself is not in this fixture."
    },
    "conditions": [],
    "confidence": 0.8,
    "confidence_basis": "The assistant's report is clear, but the original sheet is not captured and the current capacity is unresolved.",
    "consequences": [],
    "edges": {
      "contradicts": [
        "LIB-FACT-0003"
      ]
    },
    "importance": "high",
    "parent_bases": [],
    "statement": "An assistant reports that the venue booking sheet lists 20 seats for the same room.",
    "status": "conflicted",
    "title": "Booking sheet capacity claim",
    "triggers": [],
    "type": "fact",
    "valid_from": "2026-09-23T11:11:00Z",
    "valid_time_note": null,
    "valid_until": null,
    "why": "The reported sheet conflicts with the organizer's account; the current capacity must be checked."
  },
  "current_revision_id": "LIB-FACT-0004.r1",
  "derivation_map_ref": null,
  "format_version": "1",
  "history_ref": "rev://LIB-FACT-0004.r1",
  "id": "LIB-FACT-0004",
  "instance_id": "alm.synthetic.example",
  "kind": "record",
  "registered_derivative_count": 0,
  "revision_count": 1,
  "scope_id": "PROJECT-LIBRARY",
  "updated_in": "TXN-000011"
}
