{
  "created_in": "TXN-000017",
  "current": {
    "assertion": {
      "adoption_evidence": [],
      "asserted_by": "principal:synthetic-user",
      "kind": "user-stated",
      "reliability_note": "Fictional teaching scenario; these people and documents do not exist."
    },
    "conditions": [],
    "confidence": 1.0,
    "confidence_basis": "Clear fictional speaker statement; this score describes interpretation, not factual truth.",
    "consequences": [],
    "edges": {},
    "importance": "high",
    "parent_bases": [],
    "statement": "Use the spelling 'résumé' with accents on a future workshop flyer.",
    "status": "active",
    "title": "Flyer spelling",
    "triggers": [],
    "type": "preference",
    "valid_from": null,
    "valid_time_note": "Original legacy note date unknown.",
    "valid_until": null,
    "why": "An imported legacy preference mentions this spelling, but its original note was not retained."
  },
  "current_revision_id": "LIB-PREF-0001.r1",
  "derivation_map_ref": null,
  "format_version": "1",
  "history_ref": "rev://LIB-PREF-0001.r1",
  "id": "LIB-PREF-0001",
  "instance_id": "alm.synthetic.example",
  "kind": "record",
  "registered_derivative_count": 0,
  "revision_count": 1,
  "scope_id": "PROJECT-LIBRARY",
  "updated_in": "TXN-000017"
}
