{
  "created_in": "TXN-000004",
  "current": {
    "assertion": {
      "adoption_evidence": [],
      "asserted_by": "principal:synthetic-user",
      "kind": "user-stated",
      "reliability_note": "Fictional teaching scenario; these people and documents do not exist."
    },
    "conditions": [],
    "confidence": 1.0,
    "confidence_basis": "Clear fictional speaker statement; this score describes interpretation, not factual truth.",
    "consequences": [],
    "edges": {},
    "importance": "high",
    "parent_bases": [],
    "statement": "Defer the repair workshop until the room schedule is confirmed; keep it planned.",
    "status": "deferred",
    "title": "Repair workshop",
    "triggers": [
      "room schedule confirmed",
      "instructor available"
    ],
    "type": "decision",
    "valid_from": "2026-09-23T11:05:00Z",
    "valid_time_note": null,
    "valid_until": null,
    "why": "The room is unconfirmed; the user wants a delay, not cancellation."
  },
  "current_revision_id": "LIB-DEC-0001.r2",
  "derivation_map_ref": null,
  "format_version": "1",
  "history_ref": "rev://LIB-DEC-0001.r2",
  "id": "LIB-DEC-0001",
  "instance_id": "alm.synthetic.example",
  "kind": "record",
  "registered_derivative_count": 0,
  "revision_count": 2,
  "scope_id": "PROJECT-LIBRARY",
  "updated_in": "TXN-000005"
}
