{
  "created_in": "TXN-000001",
  "current": {
    "assertion": {
      "adoption_evidence": [],
      "asserted_by": "principal:synthetic-user",
      "kind": "user-stated",
      "reliability_note": "Fictional teaching scenario; these people and documents do not exist."
    },
    "conditions": [],
    "confidence": 1.0,
    "confidence_basis": "Clear fictional speaker statement; this score describes interpretation, not factual truth.",
    "consequences": [],
    "edges": {},
    "importance": "high",
    "parent_bases": [],
    "statement": "Every request enters the shared queue; use one pickup checklist while branches choose contact methods.",
    "status": "active",
    "title": "Lending request rule",
    "triggers": [],
    "type": "rule",
    "valid_from": "2026-09-23T11:09:00Z",
    "valid_time_note": null,
    "valid_until": null,
    "why": "A common checklist helps substitute volunteers without removing local access options."
  },
  "current_revision_id": "SYS-RULE-0011.r4",
  "derivation_map_ref": "map://MAP-SYS-RULE-0011",
  "format_version": "1",
  "history_ref": "rev://SYS-RULE-0011.r4",
  "id": "SYS-RULE-0011",
  "instance_id": "alm.synthetic.example",
  "kind": "record",
  "registered_derivative_count": 1,
  "revision_count": 4,
  "scope_id": "GLOBAL",
  "updated_in": "TXN-000009"
}
